Title	URL	Assignees	Status
Get more data from industry partner	https://github.com/amosproj/amos2025ss03-route-planning-app/issues/123		In Progress
Meetings take too long	https://github.com/amosproj/amos2025ss03-route-planning-app/issues/53		In Progress
Unclear responsibilities for deliverables	https://github.com/amosproj/amos2025ss03-route-planning-app/issues/56		In Progress
Make issues more specific	https://github.com/amosproj/amos2025ss03-route-planning-app/issues/55		Done
Set up communication channel with industry partner	https://github.com/amosproj/amos2025ss03-route-planning-app/issues/20		Done
Have PO/SD discussion about new issues prior to the team meeting	https://github.com/amosproj/amos2025ss03-route-planning-app/issues/18		Done
Have separate SD discussion on core features	https://github.com/amosproj/amos2025ss03-route-planning-app/issues/19		Done
PO/SD discussion meeting needs SD participation	https://github.com/amosproj/amos2025ss03-route-planning-app/issues/54		Done